{
  "$schema": "http://json-schema.org/draft-07/schema#",
  "title": "smallchat.json",
  "description": "Project manifest for smallchat — analogous to package.json for Node.js",
  "type": "object",
  "required": ["name", "version"],
  "properties": {
    "name": {
      "type": "string",
      "description": "Project name"
    },
    "version": {
      "type": "string",
      "description": "Project version (semver)",
      "pattern": "^\\d+\\.\\d+\\.\\d+(-[a-zA-Z0-9.]+)?(\\+[a-zA-Z0-9.]+)?$"
    },
    "description": {
      "type": "string",
      "description": "Human-readable project description"
    },
    "dependencies": {
      "type": "object",
      "description": "Pre-compiled vendor tool packages. Keys are package names, values are semver ranges or local file paths.",
      "additionalProperties": {
        "type": "string"
      }
    },
    "manifests": {
      "type": "array",
      "description": "Local manifest directories or files to include in compilation",
      "items": {
        "type": "string"
      }
    },
    "compiler": {
      "type": "object",
      "description": "Compiler configuration",
      "properties": {
        "embedder": {
          "type": "string",
          "enum": ["onnx", "hash", "local"],
          "description": "Embedder: onnx (default) or hash (dev/test placeholder; \"local\" is the 0.x name of hash)"
        },
        "duplicateThreshold": {
          "type": "number",
          "description": "Cosine similarity at or above which two distinct tools are a compile error (0–1, default 0.95)",
          "minimum": 0,
          "maximum": 1
        },
        "allowDuplicates": {
          "type": "boolean",
          "description": "Keep near-duplicate tools as a warning instead of a compile error"
        },
        "deduplicationThreshold": {
          "type": "number",
          "description": "Deprecated: renamed to duplicateThreshold",
          "minimum": 0,
          "maximum": 1
        },
        "collisionThreshold": {
          "type": "number",
          "description": "Collision warning threshold (0–1, default 0.89)",
          "minimum": 0,
          "maximum": 1
        },
        "generateSemanticOverloads": {
          "type": "boolean",
          "description": "Enable semantic overload generation"
        },
        "semanticOverloadThreshold": {
          "type": "number",
          "description": "Semantic overload grouping threshold (0–1, default 0.82)",
          "minimum": 0,
          "maximum": 1
        }
      }
    },
    "output": {
      "type": "object",
      "description": "Output configuration",
      "properties": {
        "path": {
          "type": "string",
          "description": "Output file path (relative to smallchat.json)"
        },
        "format": {
          "type": "string",
          "enum": ["json", "sqlite"],
          "description": "Output format"
        },
        "dbPath": {
          "type": "string",
          "description": "SQLite database path (when format is sqlite)"
        }
      }
    },
    "providerHints": {
      "type": "object",
      "description": "Provider-level compiler hint overrides, keyed by provider ID",
      "additionalProperties": {
        "$ref": "manifest.schema.json#/definitions/providerCompilerHints"
      }
    },
    "toolHints": {
      "type": "object",
      "description": "Tool-level compiler hint overrides, keyed by 'providerId.toolName'",
      "additionalProperties": {
        "$ref": "manifest.schema.json#/definitions/compilerHint"
      }
    },
    "policy": {
      "type": "object",
      "description": "Dispatch policy for runtimes loaded by `smallchat serve`. Intent-based dispatch applies all of it; MCP tools/call names a tool exactly, so only argumentCoercion affects it.",
      "properties": {
        "requireLLMForSubHighDispatch": {
          "type": "boolean",
          "default": true,
          "description": "Below HIGH confidence, run a resolved tool only when an LLM verifier approved it"
        },
        "strict": {
          "type": "boolean",
          "default": false,
          "description": "Verify every dispatch below EXACT and raise the search floor to MEDIUM"
        },
        "treatUnannotatedAsDestructive": {
          "type": "boolean",
          "default": false,
          "description": "Treat tools without MCP annotations as destructive (exact id, pinned phrase or EXACT similarity only)"
        },
        "thresholds": {
          "type": "object",
          "description": "Confidence tier thresholds",
          "properties": {
            "exact": {
              "type": "number",
              "minimum": 0,
              "maximum": 1
            },
            "high": {
              "type": "number",
              "minimum": 0,
              "maximum": 1
            },
            "medium": {
              "type": "number",
              "minimum": 0,
              "maximum": 1
            },
            "low": {
              "type": "number",
              "minimum": 0,
              "maximum": 1
            }
          },
          "additionalProperties": false
        },
        "pins": {
          "type": "array",
          "description": "Intent pins guarding sensitive selectors",
          "items": {
            "type": "object",
            "required": [
              "canonical",
              "policy"
            ],
            "properties": {
              "canonical": {
                "type": "string"
              },
              "policy": {
                "type": "string",
                "enum": [
                  "exact",
                  "elevated"
                ]
              },
              "threshold": {
                "type": "number",
                "minimum": 0,
                "maximum": 1
              },
              "aliases": {
                "type": "array",
                "items": {
                  "type": "string"
                }
              }
            },
            "additionalProperties": false
          }
        },
        "argumentCoercion": {
          "type": "string",
          "enum": [
            "none",
            "primitives"
          ],
          "default": "none",
          "description": "Coerce scalar argument types to the input schema before validation"
        }
      },
      "additionalProperties": false
    }
  }
}
